{
  "blockers": [
    "synthetic sample does not provide 12 to 24 months of history",
    "two fills are below the 500-trade intraday threshold",
    "next-bar synthetic fills are not executable book replay",
    "PBO exceeds the crypto intraday threshold",
    "one or more mandatory stress scenarios is net-negative"
  ],
  "capacity": {
    "diagnostic_notional": 1000000.0,
    "method": "10x synthetic initial capital cap"
  },
  "created_at": "2026-07-10T00:00:00Z",
  "drawdown_distribution": {
    "bootstrap_median": 0.01132166657202056,
    "bootstrap_p95": 0.0210148648136374,
    "observed_max": 0.00773694390715679
  },
  "expected_shortfall": 0.00727339382013632,
  "exposure_correlation": {
    "single_series": 1.0
  },
  "id": "risk-pkg_e3d4873fcc01427b9b502037",
  "package_id": "pkg_e3d4873fcc01427b9b502037",
  "policy_hash": "d4f248c131c6831b29c819dcb5126794c349f9e5f0de45eb0f3bf3faca915731",
  "policy_id": "risk-policy-v1-crypto_intraday",
  "risk_of_ruin_proxy": 0.0,
  "scenario_losses": [
    {
      "net_pnl": 20.8965160125,
      "pass": true,
      "scenario": "fees_x1_5"
    },
    {
      "net_pnl": 20.896510675,
      "pass": true,
      "scenario": "slippage_x2"
    },
    {
      "net_pnl": 18.953198175,
      "pass": true,
      "scenario": "latency_x2"
    },
    {
      "net_pnl": 18.896510675,
      "pass": true,
      "scenario": "depth_x0_5"
    },
    {
      "net_pnl": 16.669760675,
      "pass": true,
      "scenario": "depth_x0_25"
    },
    {
      "net_pnl": 17.009885675,
      "pass": true,
      "scenario": "maker_fill_probability_x0_5"
    },
    {
      "net_pnl": 21.009885675,
      "pass": true,
      "scenario": "funding_worst_decile"
    },
    {
      "net_pnl": 11.009885675,
      "pass": true,
      "scenario": "exchange_outage"
    },
    {
      "net_pnl": 11.009885675,
      "pass": true,
      "scenario": "missing_interval"
    },
    {
      "net_pnl": -8.990114325,
      "pass": false,
      "scenario": "correlated_gap"
    },
    {
      "net_pnl": -18.990114325,
      "pass": false,
      "scenario": "forced_deleverage"
    }
  ],
  "schema_version": 2,
  "sizing": {
    "default": "fixed_fraction",
    "kelly_use": "analytical_upper_bound_only"
  },
  "verdict": "blocked",
  "worst_windows": [
    {
      "return": -0.0019325499765674428,
      "start_index": 9
    },
    {
      "return": -0.001,
      "start_index": 6
    },
    {
      "return": 0.0,
      "start_index": 0
    }
  ]
}
